,Unnamed: 0,jobTitle,cmpName,cmpRating,cmpReviewsAmount,cmpReviews,cmpEmployees,jobCity,jobRegion,jobState,postDate,job_url,bachelor,bash,c,c++,cassandra,d3,d3.js,excel,flume,h2o,hadoop,hbase,hive,java,javascript,linux,mahout,mapreduce,master,matlab,mongodb,mssql,mysql,nosql,numpy,oozie,oracle,pandas,perl,ph.d,php,pig,postgresql,powerpoint,python,r,rdbms,ruby,saas,sas,scala,scikits.learn,scipy,shark,shell,spark,splunk,spotfire,sps,spss,sql,tableau,zookeeper
149,861.0,"Lead Big Data Analytics Developer (Telecommute/Remote/From Home) - Boston, MA",Turas Group,,16.0,,,Boston,Boston,MA,2016-09-15T12:00,http://job-openings.monster.com/monster/0dd62713-4643-435b-a300-ad675df16f0d?mescoid=1500127001001&jobPosition=28,0.0,0.0,0.0,1.0,1.0,0.0,0.0,0.0,0.0,0.0,1.0,1.0,0.0,1.0,0.0,0.0,0.0,0.0,0.0,0.0,0.0,0.0,0.0,0.0,0.0,0.0,0.0,0.0,0.0,0.0,1.0,0.0,0.0,0.0,1.0,0.0,0.0,0.0,0.0,0.0,0.0,0.0,0.0,0.0,0.0,0.0,0.0,0.0,0.0,0.0,1.0,0.0,0.0
354,1066.0,Quantitative Software Engineer (Java or Python) - Class of 2017,EverQuote,5.0,1.0,"EverQuote is a flat organization where everyone has the ability to make a measurable and large impact to the business - even at the entry level. The company is growing very quickly and there is a huge opportunity to learn a variety of skills (coding, analytical). While, auto insurance isn't the most compelling industry/product in the world, the work we do revolves around consumer behavior and can be very interesting.",51 to 200,Boston,Cambridge,MA,2016-09-15T12:00,http://job-openings.monster.com/monster/6ac07483-09e1-4936-a9af-6a12db59ab99?mescoid=1500127001001&jobPosition=23,1.0,0.0,0.0,0.0,0.0,0.0,0.0,0.0,0.0,0.0,0.0,0.0,0.0,1.0,0.0,1.0,0.0,0.0,0.0,0.0,0.0,0.0,1.0,0.0,0.0,0.0,0.0,0.0,0.0,0.0,0.0,0.0,0.0,0.0,1.0,0.0,0.0,0.0,0.0,0.0,0.0,0.0,0.0,0.0,0.0,0.0,0.0,0.0,0.0,0.0,1.0,0.0,0.0
499,1211.0,Contract SAS Programmer,Alkermes,3.9,18.0,,,Boston,Waltham,MA,2016-09-15T12:00,http://job-openings.monster.com/monster/74e7af4e-d146-4e19-91a9-af8b1f525060?mescoid=1500127001001&jobPosition=28,0.0,0.0,0.0,0.0,0.0,0.0,0.0,0.0,0.0,0.0,0.0,0.0,0.0,0.0,0.0,0.0,0.0,0.0,1.0,0.0,0.0,0.0,0.0,0.0,0.0,0.0,0.0,0.0,0.0,0.0,0.0,0.0,0.0,0.0,0.0,1.0,0.0,0.0,0.0,1.0,0.0,0.0,0.0,0.0,0.0,0.0,0.0,0.0,0.0,0.0,0.0,0.0,0.0
519,1231.0,Contract SAS Programmer,Alkermes,3.9,18.0,,,Boston,Waltham,MA,2016-09-15T12:00,http://job-openings.monster.com/monster/74e7af4e-d146-4e19-91a9-af8b1f525060?mescoid=1500127001001&jobPosition=13,0.0,0.0,0.0,0.0,0.0,0.0,0.0,0.0,0.0,0.0,0.0,0.0,0.0,0.0,0.0,0.0,0.0,0.0,1.0,0.0,0.0,0.0,0.0,0.0,0.0,0.0,0.0,0.0,0.0,0.0,0.0,0.0,0.0,0.0,0.0,1.0,0.0,0.0,0.0,1.0,0.0,0.0,0.0,0.0,0.0,0.0,0.0,0.0,0.0,0.0,0.0,0.0,0.0
648,1360.0,Software Engineer at Quant Trading Hedge Fund (HFT),Domeyard LP,,33.0,,11 to 50,Boston,Boston,MA,2016-09-15T12:00,http://job-openings.monster.com/monster/051d405b-b05f-4356-a184-b07766c896dd?mescoid=1500127001001&jobPosition=2,0.0,0.0,1.0,0.0,0.0,0.0,0.0,0.0,0.0,0.0,0.0,0.0,0.0,0.0,0.0,0.0,0.0,0.0,0.0,0.0,0.0,0.0,0.0,0.0,0.0,0.0,0.0,0.0,0.0,0.0,0.0,0.0,0.0,0.0,0.0,0.0,0.0,0.0,0.0,0.0,0.0,0.0,0.0,0.0,0.0,0.0,0.0,0.0,0.0,0.0,0.0,0.0,0.0
