,Unnamed: 0,jobTitle,cmpName,cmpRating,cmpReviewsAmount,cmpReviews,cmpEmployees,jobCity,jobRegion,jobState,postDate,job_url,bachelor,bash,c,c++,cassandra,d3,d3.js,excel,flume,h2o,hadoop,hbase,hive,java,javascript,linux,mahout,mapreduce,master,matlab,mongodb,mssql,mysql,nosql,numpy,oozie,oracle,pandas,perl,ph.d,php,pig,postgresql,powerpoint,python,r,rdbms,ruby,saas,sas,scala,scikits.learn,scipy,shark,shell,spark,splunk,spotfire,sps,spss,sql,tableau,zookeeper
0,1.0,"Data Scientist - growth, marketing research - San Fran!",CyberCoders,3.5,18.0,"As a selection representative you figure out how to construct your business starting with no outside help. You buckle down putting in 10-12 hour days, yet it will pay off in the event that you keep at it. Try not to enter this occupation supposing you can bear to be lethargic else you WILL fizzle. Great commission setup is fine for a few people however unquestionably not everybody. Youthful air and positive vibes all around.Fun culture and work environmentGreat money opportunityGreat growth opportunityUnlimited SnacksAbility to work remoteGreat company partiesCyberCoders is a solid culture company. The people and most management are very strong and are willing to assist in any way possible. It is not a 9 to 5 so you definitely need to be ready to work long hours to be successful.Sink or Swim.  Management is very hands off, even if you do well you can get swept in layoffs.  Company is not going in the right direction and their approach is very bullish.  Plenty of potential clients/candidates would not work with me due to the ""stigma"" of working with Cybercoders.  It is truly a double edged sword.allstate is a fortune 100 company that is a great experience to gain professionalism and experience. Really fun coworkersAs a recruiter you learn to build your business from scratch. You work hard putting in 10-12 hour days, but it will pay off if you keep at it. Do not enter this job thinking you can afford to be lazy else you WILL fail. 100% commission setup is fine for some people but definitely not everyone. Young atmosphere and positive vibes all around.I managed a database of clients and candidates. I did all my own business development by cold calls, emails, linkedin inmails and referrals. I sourced for candidates and matched them with my client staffing needs. Negotiated pay and bill rates and coordinated interviews and placementsCyberCoders is becoming a giant staffing firm the industry - and rightfully so! They are surrounded with so much talent from everyone in the organization.Great place to work at! Company culture is great. Love the people and atmosphere.Like the saying goes""work hard play harder""!!CyberCoders is very unprofessional.Money hoardersthey will call you all the time just to make the quotaA good supportive company and they provide pay reflective of the level of experience of the candidate.I worked for Cybercoders for about 4-months. I had heard many good things about them over the years so I was excited to be offered a position to join the team. Unfortunately, from the day I started I saw a lot of red flags that reminded me a lot of another large, international recruiting firm (RHI) where I previously worked. CC has a churn and burn environment and they micromanage you - pulling up reports throughout the day on your activity. They have a TON of meetings - team meetings, company wide meetings, individual meetings - EVERY WEEK! Over the 4 months I was there people quit or were being fired practically every week. The 3 new people on my team that started the same day as I did, were gone within 4 months. Yes, they did have cool quarterly sales party's at an ocean front resort in Orange County. And a summer party that was a blast! But aside from that, the work environment was tedious. You had to achieve a certain # of ""CA's"" per week (Cyber Actions) that you earn by securing a new job order from a client, submitting candidates for open jobs and scheduling in-person interviews between your candidate and client. If you don't meet the required number of CA's, you must attend what I referred to as a ""dunce or disciplinary"" training session for each week you missed the mark...driving 1.5 to 2 hours from their Playa Vista location to Irvine for a 45 minute meeting. Basically, taking up your entire day of productivity when the reason you're having to attend this meeting in the first place is because of what they deem your lack of productivity. Unfortunately,  more... if you have several job orders open with different clients for the same type of position, the candidates you submit only counts for 1 CA, even if you submit the same candidate to 5 different clients. So you're constantly scrambling to meet your CA numbers. A lot of people found ways to trick the system into thinking they earned CA's in order to avoid disciplinary action. WE ARE THERE TO WORK, not to surf the net or mess around so treating us like children is unnecessary.I placed four full time placements within the first 4 months I was there at a profit of almost $100k for the company, but when I called in sick one day when I was supposed to attend one of these disciplinary meetings in Irvine, I was called that very morning and told ""this isn't working out"". Yes, I was fired. I was shocked and surprised. I reminded my manager that we had just met a few days prior and he said I was doing well and making good progress. I could tell he was annoyed I had called in sick rather than drive to Irvine. He just repeated himself ""this isn't working out"". I do not recommend Cybercoders to fellow recruiters. It's a cut throat, micromanaging, churn and burn environment. Plus, you're on a draw, so you may as well just work as an independent recruiter rather than share your profits with the company because you're responsible for 100% of your own salary anyway.  lessOver the years I've seen many many jobs from Cybercoders for which I felt I was well qualified, but have never landed so much as a phone screen when applying through them.Cybercoders reason for being is to insert themselves between you and any prospective employers and extort money from those who might find you a promising candidate. Your interest or potential suitability for a job makes no difference to them, your resume won't leave their computers unless they think they can get a commission out of it. It takes more legwork, but try to filter out Cybercoder ads, target job searches to only return actual employer generated positions and send them your resume directly. You won't get every job you apply for, but at least you don't have to meet some anonymous recruiter's commission checklist before employers see your resume.One word Resume Farmers! Read many reviews were people were contacted by their 'recruiters"", recommended the candidate apply for the job via their link and never to be heard from again.Excellent recruiting environment.  Collaborative, excellent management with top-notch tools.CyberCoders is the leader in full-time technology staffing nationwide for a reason.   You are working with real people working with some of the worlds best companies providing life changing opportunities that help thousands of people grow their careers and income every year.  I read one review that said we were a Spammer and owned by Experian?  Not true.  We are not owned by Experian and your personal information isn't shared with any agency.  Our job requires many phone calls and many emails to insure we reach our targeted audience, but we are no more a spammer than Groupon or Travelzoo when you ask to receive exciting updates that match your specific interests. If you have applied for jobs and are not getting a response, there is no interview request.  You could still be a very good candidate, so followup with us and we'll do our best to make a match.  Hiring managers are very busy and find it hard to reply to every resume, so some go without a response unfortunately.  Internally, all employees of CyberCoders are treated very well with generous compensation packages as well as many in house treats and fun catered events.  The culture is fun and casual, providing recruiters with unmatched marketing and software tools to reach thousands of new passive talent everyday.Nothing feels better than helping someone find a new position and helping a trusted client fill an important need all at the same time.  Ultimately, recruiters are your friends and can help you.  Try us!After swearing myself of not returning to the staffing agency world, CyberCoders came along and completely changed my mind. Their approach and constant dedication on investment to staying ahead of the curve with regards to their technology and how they approach the best way to service both their clients and candidates has given me a place that I'm very happy to say I work for.There is plenty of opportunity for growth and the organization is not flat at all. The company as a whole is on a pretty exciting growth path as well.",,San-Francisco,San Francisco,CA,2016-12-01T12:00,http://jobview.monster.com/data-scientist-growth-marketing-research-san-fran!-job-san-francisco-ca-us-176931443.aspx?mescoid=1500152001001&jobPosition=1,0.0,0.0,0.0,0.0,0.0,0.0,0.0,0.0,0.0,0.0,1.0,0.0,1.0,0.0,0.0,0.0,0.0,0.0,1.0,0.0,0.0,0.0,0.0,0.0,0.0,0.0,0.0,0.0,0.0,0.0,0.0,1.0,0.0,0.0,1.0,1.0,0.0,0.0,0.0,0.0,0.0,0.0,0.0,0.0,0.0,0.0,0.0,0.0,0.0,0.0,1.0,0.0,0.0
1,2.0,Data Scientist (macys.com),Macy’s,,,,,San-Francisco,San Francisco,CA,2016-11-24T12:00,http://jobview.monster.com/data-scientist-macys-com-job-san-francisco-ca-us-176676113.aspx?mescoid=1500152001001&jobPosition=1,1.0,0.0,0.0,0.0,0.0,0.0,0.0,0.0,0.0,0.0,1.0,1.0,1.0,0.0,0.0,0.0,1.0,0.0,0.0,0.0,0.0,0.0,0.0,0.0,0.0,0.0,0.0,0.0,0.0,0.0,0.0,0.0,0.0,0.0,1.0,1.0,0.0,0.0,0.0,1.0,0.0,0.0,0.0,0.0,0.0,0.0,0.0,0.0,0.0,0.0,1.0,0.0,0.0
2,3.0,Data Scientist,The Judge Group,3.4,82.0,"The recruiter always called me back whenever i had any questions during the time of the contractTypical day at work was very much unsatisfying.I learned that you can't trust this organization at all.Management treats you like a dog!Co workers are back stabbers.Hardest part of the job was never being thanked for all the hard work you do.Can't say I enjoyed working for this company at all!!!a lot of turn around not too much job security, hardest part of the job is to build your client data base. management lacked a bitGreat company, great people to work with. There is a ton of opportunity to earn a good living if you work hard and dedicate yourself. There is a great work life balance and a work hard play hard culture. Very good opportunity for people who want to learn how to be a recruiter and do it well. Very strong support system and grade A training program. This company will provide you with all the tools to be successful.I only worked for Judge briefly. I started in the month of January and by resigned by May. I quickly realized how much I despised this place. By February I began looking for a new job. The office I worked in was very tiny (the size of a small closet). I worked with 3 other people in this closet. The girls I worked with were very mean and extremely rude. They would talk about you the second you walked out of a room and would stop the moment you returned. They were fake nice when you would try to talk to them. I never in my life felt so alone and excluded. I made every attempt to get along with them but they simply wouldn’t have it. I was often pulled into HR to discuss my work attire. There was a strict dress code there but only for certain people. I was in trouble for wearing black suede boots and a military style jacket yet my coworker was permitted to wear a denim jacket and cowboy boots. A lot of the women there would also wear micro miniskirts where I could see more than I wanted to yet my dresses were too short according to HR cause they didn’t cover my knees. The place was very “clicky”. It was like being back in High School. You were either a popular kid or a nerd. I tried to fit in but was pushed out every time I tried. It was very hurtful. I couldn’t get out of there fast enough! And if you like to have time off from work, forget about it! This company does not allow anyone to take unpaid time off and the accrual rate of time off is a joke. Your 1st year you get 3 days! Also, the benefits are probably some of the worst I have ever seen. For a large company,  more... they have horrible health benefits. You will literally be working there for just benefits but never get to use them because the deductibles are so high.  lessLoved the position I was in and really enjoyed working with the group of people I was with.  I learned quite a bit regarding Healthcare that I hope to use in the future.  I was very disappointed when I was told that the company I was working with did not want to keep me on past my 6 month contract date after I was pretty much convinced that I would be kept on through the next contract with the same company.I would definitely recommend this company for the college graduate or anyone who is in the market of looking for a job. They look to fit you with the best job to fit your experience.Onsite management needs improvement, high turnover in leadership resulting in job security for potential growth with job siteThis office has a great work environment! Everyone is wonderful and the director is the best. It is best to be confident in what you say and be prepared to make a lot of phone calls. You must definitely enjoy talking to people to succeed here!Good communication, responsive to employee inquiries, fair pay. Managers respond to inquiries concerning, job assignments, hours of work and pay issuesGood company to work for.  I like the fact that they pay weekly.  The beginning pay process I think may need some attention, and the fact that you have to track time in the assigned company's system, and also in Judge's system is a bit cumbersome and always involves coordination, etc.good first job out of college. not a lot of room for growth though. hours are long but you can make money at this job if you work hard. its a lot of luck so you need to be resilient.no work life balance and compensation is low for the amount of stress and hours you have to put in. Every day you have to come in and work on the same jobs over and over. Recently, they decided to stop using LinkedIn and Indeed as well, making recruiters lives harder.Worked from home on Insurance company's national project.  LOVED being a telenurse.The Judge Group was wonderful to work with -  Very Responsive, Well Compensated.  Would DEFINITELY work for them again!it seems the company as a whole has an ego problemthey are not about bettering themselves as a company but more about how they can kill one anotherthey dont even have good customersThe company is focused on metrics more than anything, and if you aren't hitting your numbers consistently then you're hearing about it.  There are a lot of jobs to be worked on, but the environment sometimes isn't very fun.  There is a lot of turnover and it doesn't show much stability.  Seems like the only successful people are those who have been there for 5+ years, junior recruiters have a hard time growing.All temp no chance for permanent.No matter what the recruiter says.Some what helpful but not a team surrounds.xxxxxxxxxxxxxxxxxxxxxxxxxxxxxxxxxxxxxxxxxxxxxxxxxxxxxxxxxxxxxxxxxxxxxxxxxxxxxxxxxxxxxxxxxxxxxxxxxxxxxxxxxxxxxxxxxxxxxxxxxxxxxxxxLove this company, the only problem is the Medical benefits, other than that it's awesome! This is a family oriented Company.Very skilled in matching employers and employees. I was placed in a position where I could shine.  I was able to learn quickly and cover many areas of accounting process.Most of the branches are pretty ok at judge, but working for healthcare in the corporate office (conshy) is extremely stressful.  In the past year alone they have gone through two internal recruiters which you would think is a bad sign since now the managers themselves are doing the internal recruiting.  Some account managers are very high strung, and those who run the office treat the recruiters like a number.  Most recruiters have to bend/break the rules to meet quotas mainly out of fear for being yelled at.  These recruiters work extremely hard, and at least 45 hours a week not including all the work from home to keep up with the cycle.They say the pay scale is competitive, however it is pretty basic compared to other firms, honestly 32,000 (about 13 bucks an hour...) after you get your bachelors is really low.  I feel like they are taking advantage of students coming right out of college. The commission plan is ok but its very rare to make anything noticeable in commission until after six months. The promotions they run are fairly difficult to hit, one recruiter out of thirty might get a small gift for hitting a quota. As recruiters we've been yelled at, and cursed at for things that we cannot control such as a candidate taking another job, not showing for their interview despite telling us they would, etc.  Again kicking you while you are down.  Since they try to motivate by fear, most people are too scared of losing their job to report anything.  If you are recently graduated and have few other options, then get some experience there and get out.  Hardest  more... part of the job - hitting the quota.Most enjoyable part - the recruiters and recruiting managers are nice people, but they are being taken advantage of.  The Judge family and executives seem like genuine people, though you dont hear much from them.  lessI enjoy my current position at Judge Healthcare. Lots of opportunity here to grow.I really enjoy the people and it is def a work hard play hard type environment",201 to 500,San-Francisco,San Francisco,CA,2016-11-25T12:00,http://jobview.monster.com/data-scientist-job-san-francisco-ca-us-176710549.aspx?mescoid=1500152001001&jobPosition=1,0.0,0.0,0.0,0.0,0.0,0.0,0.0,0.0,0.0,0.0,1.0,0.0,0.0,0.0,0.0,0.0,0.0,1.0,0.0,1.0,0.0,0.0,0.0,0.0,0.0,0.0,0.0,0.0,0.0,0.0,0.0,0.0,0.0,0.0,0.0,1.0,0.0,0.0,0.0,1.0,0.0,0.0,0.0,0.0,0.0,0.0,0.0,0.0,0.0,0.0,0.0,0.0,0.0
3,4.0,Data Scientist  - Big Data Immediate Need,Company is into Data Analytics,,,,,San-Francisco,San Mateo,CA,2016-12-04T12:00,http://job-openings.monster.com/monster/4331783d-8f93-4061-bce3-9e327e7a510e?mescoid=1500152001001&jobPosition=1,0.0,0.0,0.0,0.0,0.0,0.0,0.0,0.0,0.0,0.0,0.0,0.0,0.0,0.0,0.0,0.0,0.0,0.0,0.0,0.0,0.0,0.0,0.0,0.0,0.0,0.0,0.0,0.0,0.0,0.0,0.0,0.0,0.0,0.0,0.0,0.0,0.0,0.0,0.0,0.0,0.0,0.0,0.0,0.0,0.0,0.0,0.0,0.0,0.0,0.0,0.0,0.0,0.0
4,5.0,Data Scientist- Multiple States,Technical Consulting Firm,5.0,1.0,Great job security until they decided to close down. I really enjoyed working there.,,San-Francisco,San Francisco,CA,2016-11-28T12:00,http://job-openings.monster.com/monster/980b7ca2-1a57-469d-a31d-501cf0788111?mescoid=1500152001001&jobPosition=3,0.0,0.0,0.0,0.0,0.0,0.0,0.0,0.0,0.0,0.0,0.0,0.0,0.0,0.0,0.0,0.0,0.0,0.0,0.0,0.0,0.0,0.0,0.0,0.0,0.0,0.0,0.0,0.0,0.0,0.0,0.0,0.0,0.0,0.0,0.0,0.0,0.0,0.0,0.0,0.0,0.0,0.0,0.0,0.0,0.0,0.0,0.0,0.0,0.0,0.0,0.0,0.0,0.0
5,6.0,Data Scientist   Alternative Research,Glocomms,,902.0,,,San-Francisco,Berkeley,CA,2016-12-03T12:00,http://job-openings.monster.com/monster/5e9b6d4f-24d0-4403-aa08-ded08813c9a8?mescoid=1500152001001&jobPosition=4,0.0,0.0,0.0,0.0,0.0,0.0,0.0,0.0,0.0,0.0,0.0,0.0,0.0,0.0,0.0,0.0,0.0,0.0,0.0,0.0,0.0,0.0,0.0,0.0,0.0,0.0,0.0,0.0,0.0,0.0,0.0,0.0,0.0,0.0,0.0,0.0,0.0,0.0,0.0,0.0,0.0,0.0,0.0,0.0,0.0,0.0,0.0,0.0,0.0,0.0,0.0,0.0,0.0
