,Unnamed: 0,jobTitle,cmpName,cmpRating,cmpReviewsAmount,cmpReviews,cmpEmployees,jobCity,jobRegion,jobState,postDate,job_url,bachelor,bash,c,c++,cassandra,d3,d3.js,excel,flume,h2o,hadoop,hbase,hive,java,javascript,linux,mahout,mapreduce,master,matlab,mongodb,mssql,mysql,nosql,numpy,oozie,oracle,pandas,perl,ph.d,php,pig,postgresql,powerpoint,python,r,rdbms,ruby,saas,sas,scala,scikits.learn,scipy,shark,shell,spark,splunk,spotfire,sps,spss,sql,tableau,zookeeper
45,3098.0,GIS Web Developer - TS/SCI Clearance Required!,CyberCoders,3.5,18.0,,,Washington,McLean,VA,2016-11-18T12:00,http://jobview.monster.com/gis-web-developer-ts-sci-clearance-required!-job-mclean-va-us-176318219.aspx?mescoid=1500129001001&jobPosition=19,1.0,0.0,0.0,0.0,0.0,0.0,0.0,0.0,0.0,0.0,0.0,0.0,0.0,0.0,1.0,0.0,0.0,0.0,1.0,0.0,0.0,0.0,0.0,0.0,0.0,0.0,0.0,0.0,0.0,0.0,0.0,0.0,0.0,0.0,0.0,0.0,0.0,0.0,0.0,0.0,0.0,0.0,0.0,0.0,0.0,0.0,0.0,0.0,0.0,0.0,0.0,0.0,0.0
52,3105.0,Associate Scientist Opportunity in Toxicology: Bioreliance,Randstad,3.8,7200.0,,,Washington,Rockville,MD,2016-11-18T12:00,http://job-openings.monster.com/monster/eab50ace-755a-438c-9433-67dc15131069?mescoid=1900267001001&jobPosition=5,0.0,0.0,0.0,0.0,0.0,0.0,0.0,0.0,0.0,0.0,0.0,0.0,0.0,0.0,0.0,0.0,0.0,0.0,0.0,0.0,0.0,0.0,0.0,0.0,0.0,0.0,0.0,0.0,0.0,0.0,0.0,0.0,0.0,0.0,0.0,0.0,0.0,0.0,0.0,0.0,0.0,0.0,0.0,0.0,0.0,0.0,0.0,0.0,0.0,0.0,0.0,0.0,0.0
138,3191.0,"CS Data Scientist, Mid",Booz Allen Hamilton Inc.,,,,,Washington,Alexandria,VA,2016-11-18T12:00,http://job-openings.monster.com/monster/bacf5706-275c-4aa9-b521-4692a5aaa40c?mescoid=1500152001001&jobPosition=8,0.0,0.0,1.0,1.0,0.0,0.0,0.0,0.0,0.0,0.0,1.0,1.0,0.0,1.0,0.0,1.0,0.0,1.0,0.0,0.0,0.0,0.0,0.0,1.0,0.0,0.0,0.0,0.0,0.0,0.0,0.0,0.0,0.0,0.0,0.0,0.0,0.0,0.0,0.0,0.0,0.0,0.0,0.0,0.0,0.0,1.0,0.0,0.0,0.0,0.0,0.0,0.0,0.0
170,3223.0,Data Analyst 4 (Statistician),Salient CRGT,3.9,7.0,"Agile company that encourages it's employees to bring new ideas to the table.  My manager is among the best, He does not micro-manage and lets you figure out the best solution to issues.We worked as a good team where all the ELT instructors were very well qualified for the job.  The management did their part and I enjoyed my work.  We were given all the help needed.Due to frequent acquisitions and work load, the work life balance is difficult. Management tends to stay put, leaving little room for others to grow into management roles.I work as a contractor so the environment is based on the customer, so far i've had a good experience in the workplace. As far as the company goes, it's based on the people which i've only met one which is my PM but he's cool. so its good representation. My company relationship so far is just business, i work and i get paidResponsible for independent, local system support of our Sorrento Valley and Temecula offices.  Also, provide remote support to user’s around the company using remote tools for about 1200 users.  Duties include network maintenance, patching servers, building out imagines and servers using the VSphere client 5.5.  Including building out Altigen phones using the MaxAdministrator.  I work routinely in office 365 active directory creating and removing accounts.Have worked with this company through various transitions since 2002.  Management has always worked to keep our contract viable.Pay and compensation are fine. Annual performance bonuses are not bad either. Managers tend to care about your needs.You are still a scumbag contractor.","1,001 to 5,000",Washington,Washington,DC,2016-11-18T12:00,http://job-openings.monster.com/monster/c78e0cda-ff38-40e2-b725-2b9e2cb8dd61?mescoid=1300087001001&jobPosition=5,1.0,0.0,0.0,0.0,0.0,0.0,0.0,1.0,0.0,0.0,0.0,0.0,0.0,0.0,0.0,0.0,0.0,0.0,0.0,0.0,0.0,0.0,0.0,0.0,0.0,0.0,0.0,0.0,0.0,0.0,0.0,0.0,0.0,0.0,0.0,1.0,0.0,0.0,0.0,0.0,0.0,0.0,0.0,0.0,0.0,0.0,0.0,0.0,0.0,1.0,1.0,1.0,0.0
818,3871.0,"Geospatial Analyst, Senior",Leidos,3.8,199.0,,"10,000+",Washington,SPRINGFIELD,VA,2016-11-18T12:00,http://job-openings.monster.com/monster/3cf0016e-55f7-4b3e-8d7e-812c2d703e5b?mescoid=1500140001001&jobPosition=23,1.0,0.0,0.0,0.0,0.0,0.0,0.0,0.0,0.0,0.0,0.0,0.0,0.0,0.0,0.0,0.0,0.0,0.0,0.0,0.0,0.0,0.0,0.0,0.0,0.0,0.0,0.0,0.0,0.0,0.0,0.0,0.0,0.0,0.0,0.0,0.0,0.0,0.0,0.0,0.0,0.0,0.0,0.0,0.0,0.0,0.0,0.0,0.0,0.0,0.0,0.0,0.0,0.0
